{
  "id": "11111111-1111-1111-1111-111111111111",
  "productId": "22222222-2222-2222-2222-222222222222",
  "warehouseId": "33333333-3333-3333-3333-333333333333",
  "locationId": "44444444-4444-4444-4444-444444444444",
  "quantity": 5,
  "availableQuantity": 15,
  "reservedQuantity": 5,
  "allocatedQuantity": 0,
  "action": "reserve"
}
